{
  "source_file": "evytra-Order2260892.pdf",
  "customer_profile": "evytra",
  "file_hash": "fixture-placeholder",
  "process_time": "2026-04-03T00:00:00",
  "confidence": 0.95,
  "warnings": [
    "Suspicious item 30 amount or price basis detected",
    "Parsed item amounts do not reconcile to order total"
  ],
  "status": "review",
  "header": {
    "customer_name": "EVYTRA GmbH",
    "customer_code": "evytra",
    "po_number": "2260892",
    "po_date": "2026-03-23",
    "currency": "EUR",
    "total_amount": 46350.0,
    "buyer_address": "Sturmbuhlstr. 180 - 184, 78054 VS-Schwenningen",
    "supplier_id_at_customer": "704000",
    "customer_contact_person": "Janine Kirchhof",
    "customer_contact_phone": "+49 212 / 383923-12",
    "customer_contact_email": "Janine.Kirchhof@evytra.com",
    "supplier_name": "Tianjin Printronics Circuit Corp.",
    "supplier_contact_person": "Mrs Tina Zhang",
    "supplier_address": "No. 53 Hanghai Rd, Airport Economic Area, 300308 Tianjin / China, VR CHINA",
    "delivery_terms": "DAP Schwenningen",
    "payment_terms": "90 days net",
    "shipment_mode": "Airfreight",
    "delivery_tolerance_positive_pct": 0.0,
    "delivery_tolerance_negative_pct": 0.0,
    "delivery_tolerance_raw": ">>> Deliver: + / - 0 % <<<",
    "blanket_order_note": "Blanket order quantity: 13.000 pcs. ./. order no. 2250134 3.000 pcs ./. order no. 2251915 3.000 pcs ./. order no. 2253449 3.000 pcs. ./. this order 4.000 pcs. rest quantity: 0 pcs.",
    "production_note": "Production lot: 4.000 pcs. It is very important that Tianjin produce the complete quantity. Please store the boards in your stock. It is possible that our customer will change the delivery date for item 20 + 30 + 40. To react in a short term the boards must be stocked. Please confirm.",
    "packaging_note": "Please pack the boards that we can deliver 4x 1.000 pcs. without having to repack, thanks."
  },
  "items": [
    {
      "line_no": 10,
      "qty": 1000,
      "unit": "pcs",
      "customer_material": "4001391504",
      "material_description": "735098",
      "customer_release_no": "30601875",
      "customer_release_pos": "10.000",
      "delivery_date": "2026-05-01",
      "price_basis_qty": 100,
      "price_basis_unit": "pcs",
      "unit_price": 45.0,
      "amount": 450.0,
      "currency": "EUR"
    },
    {
      "line_no": 20,
      "qty": 1000,
      "unit": "pcs",
      "customer_material": "4001391504",
      "material_description": "735098",
      "customer_release_no": "30601876",
      "customer_release_pos": "10.000",
      "delivery_date": "2026-05-29",
      "price_basis_qty": 100,
      "price_basis_unit": "pcs",
      "unit_price": 45.0,
      "amount": 450.0,
      "currency": "EUR"
    },
    {
      "line_no": 30,
      "qty": 1000,
      "unit": "pcs",
      "customer_material": "4001391504",
      "material_description": "735098",
      "customer_release_no": "30601877",
      "customer_release_pos": "10.000",
      "delivery_date": "2026-06-26",
      "price_basis_qty": 1,
      "price_basis_unit": "pcs",
      "unit_price": 45.0,
      "amount": 45000.0,
      "currency": "EUR"
    },
    {
      "line_no": 40,
      "qty": 1000,
      "unit": "pcs",
      "customer_material": "4001391504",
      "material_description": "735098",
      "customer_release_no": "30601878",
      "customer_release_pos": null,
      "delivery_date": "2026-07-03",
      "price_basis_qty": 100,
      "price_basis_unit": "pcs",
      "unit_price": 45.0,
      "amount": 450.0,
      "currency": "EUR"
    }
  ]
}
